id,headline,person,stages,investment_locations,location,position,min_investment,max_investment,target_investment,headline,previous_position,previous_firm,areas_of_interest_freeform,no_current_interest_freeform,vote_count,firm,degrees,investments_on_record
29137,CEO and General Partner at 7BC Venture Capital,Andrew Romans,Series B,"Orange, California","Austin, Texas",general_partner,100000,5000000,500000,CEO and General Partner at 7BC Venture Capital,,,,,0,7BC Venture Capital,"{'id': '9944', 'name': 'BA', 'field_of_study': 'Political Science, French & German Literature', 'school': {'id': '27317', 'name': 'University of Vermont', 'display_name': 'University of Vermont', 'total_student_count': 10}}","{'id': '9867', 'company_display_name': 'Dealflicks', 'total_raised': ['$1.7M'], 'coinvestor_names': ['Daniel Curran (Curran Rosschou Venture Capital)', 'Joshua B. Siegel (Rubicon VC)', 'Lawrence Braitman'], 'investor_profile_funding_rounds': [{'id': '106455', 'is_lead': None, 'board_role': None, 'funding_round': {'id': '1659', 'stage': 'Seed Round', 'date': '2014-07-21T00:00:00Z', 'amount': '$1.7M'}}, {'id': '106452', 'is_lead': None, 'board_role': None, 'funding_round': {'id': '25866', 'stage': 'Seed Round', 'date': '2013-05-01T00:00:00Z', 'amount': '0'}}]}"
11262,"Managing Partner at Ten VC, General Partner at Elementum Ventures",Ben Patterson,Pre-seed,"San Francisco, California","San Francisco, California",general_partner,250000,2000000,750000,"Managing Partner at Ten VC, General Partner at Elementum Ventures",,,,,0,Elementum Ventures,"{'id': '5410', 'name': 'B.A.', 'field_of_study': 'Music - Jazz Performance', 'school': {'id': '37516', 'name': 'Whitworth University', 'display_name': 'Whitworth University', 'total_student_count': 1}}","{'id': '29436', 'company_display_name': 'Anduril Industries', 'total_raised': ['$2.2B'], 'coinvestor_names': ['David Ulevitch (Andreessen Horowitz)', 'Hemant Taneja (General Catalyst)', 'Katherine Boyle (Andreessen Horowitz)', 'Jackson Moses (Afore Capital)', 'Ross Fubini (XYZ Venture Capital)', 'Mislav Tolusic (Marlinspike)', 'Lachy Groom (LGF)', 'Josh Manchester (Champion Hill Labs)', 'Greg Castle (Anorak Ventures)', 'Matthew White', 'William Miller', 'Elad Gil', 'Mircea Pasoi'], 'investor_profile_funding_rounds': [{'id': '115594', 'is_lead': None, 'board_role': None, 'funding_round': {'id': '55050', 'stage': 'Seed Round', 'date': '2017-08-11T00:00:00Z', 'amount': '0'}}]}"
8257,General Partner at Meritech Capital,Alex Clayton,Series D,"New York, New York","San Francisco, California",general_partner,5000000,25000000,12000000,General Partner at Meritech Capital,,,,,1,Meritech Capital Partners,,"{'id': '11199', 'company_display_name': 'tray.io', 'total_raised': ['$150M'], 'coinvestor_names': ['Puneet Agarwal (True Ventures)', 'Glenn Solomon (GGV Capital)', 'Tom Hulme (GV (Google Ventures))', 'Andy McLoughlin (Uncork Capital)', 'Alex Kurland (Meritech Capital Partners)', 'Carine Magescas (AngelPad)', 'Thomas Korte (AngelPad)', 'Mike Chalfen (Chalfen Ventures)'], 'investor_profile_funding_rounds': [{'id': '126830', 'is_lead': None, 'board_role': None, 'funding_round': {'id': '68565', 'stage': 'Series C', 'date': '2022-09-27T00:00:00Z', 'amount': '$40M'}}, {'id': '66358', 'is_lead': None, 'board_role': None, 'funding_round': {'id': '26506', 'stage': 'Series C', 'date': '2019-11-26T00:00:00Z', 'amount': '$50M'}}, {'id': '45770', 'is_lead': True, 'board_role': None, 'funding_round': {'id': '26466', 'stage': 'Series B', 'date': '2019-04-29T00:00:00Z', 'amount': '$37M'}}]}"
13877,General Partner at SemperVirens Venture Capital,Allison Baum,Series A,San Francisco Bay Area,"San Francisco, California",general_partner,100000,10000000,1000000,General Partner at SemperVirens Venture Capital,,,,,1,SemperVirens Venture Capital,,"{'id': '60410', 'company_display_name': 'AlwaysHired', 'total_raised': ['$500K'], 'coinvestor_names': ['Aanand Radia (University Ventures)'], 'investor_profile_funding_rounds': [{'id': '76299', 'is_lead': None, 'board_role': None, 'funding_round': {'id': '41827', 'stage': 'Seed Round', 'date': '2017-01-31T00:00:00Z', 'amount': '$500K'}}]}"
5480,CEO + General Partner at Pegasus Tech Ventures,Anis Uzzaman,Seed,United States,United States,general_partner,100000,10000000,1000000,CEO + General Partner at Pegasus Tech Ventures,,,,,1,Pegasus Tech Ventures,,"{'id': '40866', 'company_display_name': 'Zuu Online', 'total_raised': ['$3.7M'], 'coinvestor_names': [], 'investor_profile_funding_rounds': [{'id': '2022', 'is_lead': False, 'board_role': None, 'funding_round': {'id': '1938', 'stage': 'Venture Round', 'date': '2015-09-28T00:00:00Z', 'amount': '$3.7M'}}]}"
8433,General Partner at CRV,Anna Khan,Series B,"Cambridge, Massachusetts",United States,general_partner,500000,20000000,13000000,General Partner at CRV,,,,,1,CRV,,"{'id': '14919', 'company_display_name': 'Agora', 'total_raised': ['$76M'], 'coinvestor_names': ['Mark Goldberg (Index Ventures)', 'Tomer Diari (Aleph VC)', 'Jonathan Rosenbaum (Insight Partners)', 'Jerry Yang (AME Cloud Ventures)', 'Guy Katsovich (Fusion VC)', 'Jason Calacanis (LAUNCH)', 'Kevin Hartz (A* Capital (A Star Capitail))', 'Kurt Ramirez (Nine Four Ventures)', 'John Curtius (Cedar Capital Group)', 'Vic Koch (Koch Fund)', 'Lee Linden (Quiet Capital)', 'Ramtin Naimi (Abstract Ventures)', 'Charlie Songhurst', 'Nicolas Berggruen'], 'investor_profile_funding_rounds': [{'id': '119312', 'is_lead': True, 'board_role': None, 'funding_round': {'id': '65700', 'stage': 'Seed Round', 'date': '2021-05-06T00:00:00Z', 'amount': '$7.5M'}}]}"
6101,General Partner at Orange Fund,Ben Huh,Series A,"San Francisco, California","San Francisco, California",general_partner,100000,5000000,1500000,General Partner at Orange Fund,,,,,1,Orange Fund (Orange DAO),"{'id': '2279', 'name': 'BSJ', 'field_of_study': 'Journalism, Sociology', 'school': {'id': '26039', 'name': 'Northwestern University', 'display_name': 'Northwestern University', 'total_student_count': 49}}","{'id': '69996', 'company_display_name': 'Analog', 'total_raised': [], 'coinvestor_names': ['Arjun Sethi (Tribe Capital)', 'Louis Kang (Accelr8)', 'Peter Bordes (Trajectory Ventures)', ""Shaan Puri (Shaan's All Access Fund)"", 'Sahil Bloom (SRB Ventures)', 'Orion Willow Parrott (Orange Fund (Orange DAO))'], 'investor_profile_funding_rounds': [{'id': '108370', 'is_lead': None, 'board_role': None, 'funding_round': {'id': '58866', 'stage': 'Seed Round', 'date': '2022-03-01T00:00:00Z', 'amount': '0'}}]}"
9116,Founder and General Partner at Foundation Capital,Bill Elmore,Series A,"Menlo Park, California","Menlo Park, California",general_partner,1000000,15000000,6000000,Founder and General Partner at Foundation Capital,,,,,1,Foundation Capital,"{'id': '1815', 'name': 'Master of Business Administration (MBA)', 'field_of_study': None, 'school': {'id': '25258', 'name': 'Stanford University Graduate School of Business', 'display_name': 'Stanford University Graduate School of Business', 'total_student_count': 249}}","{'id': '41341', 'company_display_name': 'InSpeed Networks', 'total_raised': ['$2M'], 'coinvestor_names': ['David Carrico (Jlabs)'], 'investor_profile_funding_rounds': [{'id': '3577', 'is_lead': False, 'board_role': None, 'funding_round': {'id': '3243', 'stage': 'Seed Round', 'date': '2015-08-14T00:00:00Z', 'amount': '$2M'}}]}"
8874,General Partner at Canaan Partners,Brent Ahrens,Series A,"Menlo Park, California","Menlo Park, California",general_partner,250000,20000000,10000000,General Partner at Canaan Partners,,,,,1,Canaan Partners,,"{'id': '41537', 'company_display_name': 'Elevation Pharmaceuticals', 'total_raised': ['$77M'], 'coinvestor_names': ['Heath Lukatch (Red Tree Venture Capital)'], 'investor_profile_funding_rounds': [{'id': '4403', 'is_lead': False, 'board_role': None, 'funding_round': {'id': '3907', 'stage': 'Series B', 'date': '2012-01-04T00:00:00Z', 'amount': '$30M'}}, {'id': '4405', 'is_lead': False, 'board_role': None, 'funding_round': {'id': '3909', 'stage': 'Series A', 'date': '2011-09-26T00:00:00Z', 'amount': '$17M'}}, {'id': '4407', 'is_lead': False, 'board_role': None, 'funding_round': {'id': '3911', 'stage': 'Series A', 'date': '2010-01-21T00:00:00Z', 'amount': '$30M'}}]}"
22055,Co-Founder & General Partner at Patron,Brian Cho,Series A,San Francisco Bay Area,San Francisco Bay Area,general_partner,750000,4000000,2000000,Co-Founder & General Partner at Patron,,,,,1,Patron,,"{'id': '59457', 'company_display_name': 'Elodie Games', 'total_raised': ['$33M'], 'coinvestor_names': ['Jonathan Lai (Andreessen Horowitz)', 'Chris Ovitz (Electric Ant)', 'Sam Englebardt (Galaxy Digital)'], 'investor_profile_funding_rounds': [{'id': '84334', 'is_lead': None, 'board_role': None, 'funding_round': {'id': '40538', 'stage': 'Series A', 'date': '2021-09-16T00:00:00Z', 'amount': '$33M'}}]}"
8942,Norwest Venture Partners - no early stage companies please,Casper de Clercq,Series A,"Palo Alto, California","San Francisco, California",general_partner,1000000,30000000,12500000,Norwest Venture Partners - no early stage companies please,,,,,1,Norwest Venture Partners,,"{'id': '41859', 'company_display_name': 'iRhythm Technologies', 'total_raised': ['$99M'], 'coinvestor_names': ['Josh Green (Mohr Davidow Ventures)'], 'investor_profile_funding_rounds': [{'id': '5474', 'is_lead': False, 'board_role': {'id': '2265', 'title': 'Board Member'}, 'funding_round': {'id': '4770', 'stage': 'Series E', 'date': '2014-05-22T00:00:00Z', 'amount': '$27M'}}, {'id': '5477', 'is_lead': True, 'board_role': {'id': '2265', 'title': 'Board Member'}, 'funding_round': {'id': '4772', 'stage': 'Series D', 'date': '2013-04-10T00:00:00Z', 'amount': '$16M'}}]}"
5989,General Partner at Benchmark,Chetan Puttagunta,Series A,"Menlo Park, California",San Francisco Bay Area,general_partner,1000000,15000000,8000000,General Partner at Benchmark,,,,,1,Benchmark,,"{'id': '13891', 'company_display_name': 'Forter', 'total_raised': ['$530M'], 'coinvestor_names': [""Rory O'Driscoll (Scale Venture Partners)"", 'Alexander Niehenke (Scale Venture Partners)', 'Elliott Robinson (Bessemer Venture Partners)', 'Melissa Cannon Guzy (Arbor Ventures)', 'Shmil Levy (Sequoia Capital Israel)', 'Ravi Viswanathan (NewView Capital)', 'Philippe Suchet (PS Investments)', 'Christopher North (L Catterton Growth)', 'Luis Valdich (Citi Ventures)', 'John Curtius (Cedar Capital Group)', 'Jamie Montgomery (March Capital)', 'Julien Codorniou (Felix Capital)', 'Dan Raveh'], 'investor_profile_funding_rounds': [{'id': '5747', 'is_lead': False, 'board_role': {'id': '2351', 'title': 'Board Observer'}, 'funding_round': {'id': '4967', 'stage': 'Series C', 'date': '2016-04-21T00:00:00Z', 'amount': '$32M'}}]}"
6073,Founding General Partner at Lightspeed Venture Partners,Chris Schaepe,Series A,"San Francisco, California",San Francisco Bay Area,general_partner,3000000,20000000,15000000,Founding General Partner at Lightspeed Venture Partners,,,,,1,Lightspeed Venture Partners,"{'id': '3799', 'name': 'Master of Business Administration (MBA)', 'field_of_study': None, 'school': {'id': '25671', 'name': 'Stanford Graduate School of Business', 'display_name': 'Stanford Graduate School of Business', 'total_student_count': 26}}","{'id': '16680', 'company_display_name': 'Virtual Instruments', 'total_raised': ['$28M'], 'coinvestor_names': ['Hemant Taneja (General Catalyst)'], 'investor_profile_funding_rounds': [{'id': '35756', 'is_lead': False, 'board_role': None, 'funding_round': {'id': '21020', 'stage': 'Series D', 'date': '2012-09-26T00:00:00Z', 'amount': '$28M'}}]}"
9723,General Partner at U.S. Venture Partners,Dafina Toncheva,Seed,"Menlo Park, California","Menlo Park, California",general_partner,2000000,10000000,6000000,General Partner at U.S. Venture Partners,,,,,1,U.S. Venture Partners (USVP),"{'id': '7259', 'name': 'MBA', 'field_of_study': None, 'school': {'id': '25258', 'name': 'Stanford University Graduate School of Business', 'display_name': 'Stanford University Graduate School of Business', 'total_student_count': 249}}","{'id': '71047', 'company_display_name': 'InsideSales', 'total_raised': ['$250M'], 'coinvestor_names': ['Dave Barrett (Polaris Partners)', 'Steve Krausz (U.S. Venture Partners (USVP))'], 'investor_profile_funding_rounds': [{'id': '141112', 'is_lead': None, 'board_role': None, 'funding_round': {'id': '60634', 'stage': 'Series D', 'date': '2017-01-18T00:00:00Z', 'amount': '$50M'}}, {'id': '141111', 'is_lead': None, 'board_role': None, 'funding_round': {'id': '60632', 'stage': 'Series D', 'date': '2015-03-18T00:00:00Z', 'amount': '$61M'}}, {'id': '141110', 'is_lead': None, 'board_role': None, 'funding_round': {'id': '60631', 'stage': 'Series C', 'date': '2014-04-28T00:00:00Z', 'amount': '$100M'}}, {'id': '141102', 'is_lead': True, 'board_role': None, 'funding_round': {'id': '76424', 'stage': 'Series B', 'date': '2013-01-08T00:00:00Z', 'amount': '$37M'}}]}"
14040,General Partner at Frazier Healthcare Partners,Daniel Estes,Series B,"Menlo Park, California","Palo Alto, California",general_partner,100000,5000000,1500000,General Partner at Frazier Healthcare Partners,,,,,1,Frazier Healthcare Partners,,"{'id': '76107', 'company_display_name': 'Sudo Biosciences', 'total_raised': ['$37M'], 'coinvestor_names': [], 'investor_profile_funding_rounds': [{'id': '127541', 'is_lead': True, 'board_role': None, 'funding_round': {'id': '70271', 'stage': 'Series A', 'date': '2022-09-28T00:00:00Z', 'amount': '$37M'}}]}"
6674,Founder and General Partner at CapitalG,David Lawee,Series B,"San Francisco, California","San Francisco, California",general_partner,100000,5000000,1500000,Founder and General Partner at CapitalG,,,,,1,CapitalG,"{'id': '3856', 'name': 'MBA', 'field_of_study': None, 'school': {'id': '26737', 'name': 'University of Chicago', 'display_name': 'University of Chicago', 'total_student_count': 23}}","{'id': '9817', 'company_display_name': 'Credit Karma', 'total_raised': ['$340M'], 'coinvestor_names': ['Ron Conway (SV Angel)', 'Ronald Conway Sr. (SV Angel)', 'Aydin Senkut (Felicis Ventures)', 'Frank Rotman (QED Investors)', 'Dave McClure (Practical Venture Capital)'], 'investor_profile_funding_rounds': [{'id': '114116', 'is_lead': None, 'board_role': {'id': '3136', 'title': 'Member of the Board of Directors'}, 'funding_round': {'id': '62919', 'stage': 'Series D', 'date': '2014-09-29T00:00:00Z', 'amount': '$75M'}}, {'id': '7747', 'is_lead': False, 'board_role': {'id': '3136', 'title': 'Member of the Board of Directors'}, 'funding_round': {'id': '2448', 'stage': 'Series C', 'date': '2014-09-29T00:00:00Z', 'amount': '$75M'}}, {'id': '7749', 'is_lead': True, 'board_role': {'id': '3136', 'title': 'Member of the Board of Directors'}, 'funding_round': {'id': '6328', 'stage': 'Series C', 'date': '2014-03-12T00:00:00Z', 'amount': '$85M'}}]}"
17647,General Partner at Coatue Management,David Schneider,Series B,San Francisco Bay Area,San Francisco Bay Area,general_partner,250000,4000000,2125000,General Partner at Coatue Management,,,,,1,Coatue,,"{'id': '57032', 'company_display_name': 'Grafana Labs', 'total_raised': ['$530M'], 'coinvestor_names': ['Gaurav Gupta (Lightspeed Venture Partners)', 'Carl Eschenbach (Sequoia Capital)'], 'investor_profile_funding_rounds': [{'id': '73705', 'is_lead': True, 'board_role': None, 'funding_round': {'id': '40704', 'stage': 'Series C', 'date': '2021-08-24T00:00:00Z', 'amount': '$220M'}}]}"
8870,General Partner at Canaan Partners,Deepak Kamra,Pre-seed,"Menlo Park, California","Menlo Park, California",general_partner,250000,20000000,10000000,General Partner at Canaan Partners,,,,,1,Canaan Partners,,"{'id': '14789', 'company_display_name': 'Zmanda', 'total_raised': ['$13M'], 'coinvestor_names': ['Mitch Kitamura (DNX Ventures)', 'Salil Pradhan'], 'investor_profile_funding_rounds': [{'id': '8282', 'is_lead': False, 'board_role': None, 'funding_round': {'id': '6707', 'stage': 'Series B', 'date': '2007-05-22T00:00:00Z', 'amount': '$8M'}}, {'id': '8288', 'is_lead': True, 'board_role': None, 'funding_round': {'id': '6713', 'stage': 'Series A', 'date': '2005-01-01T00:00:00Z', 'amount': '$5M'}}]}"
15592,General Partner at Lobby Capital,Eric Carlborg,Seed,San Francisco Bay Area,"Menlo Park, California",general_partner,100000,12000000,5000000,General Partner at Lobby Capital,,,,,1,Lobby Capital,,"{'id': '13133', 'company_display_name': 'Stance', 'total_raised': ['$120M'], 'coinvestor_names': ['Tod Francis (Shasta Ventures)', 'Nasir Jones (QueensBridge Venture Partners)', 'Mary Meeker (Bond)', 'Pravin Vazirani (Owl Rock Capital Partners)', 'Scott Stanford (ACME Capital)', 'Jeff Kearl (Pelion Venture Partners)', 'Patrick Murphy (Semble Ventures)', 'Troy Carter', 'Matt Coffin', 'Anthony Saleh'], 'investor_profile_funding_rounds': [{'id': '77889', 'is_lead': None, 'board_role': None, 'funding_round': {'id': '12550', 'stage': 'Series D', 'date': '2016-04-28T00:00:00Z', 'amount': '$30M'}}, {'id': '77891', 'is_lead': True, 'board_role': None, 'funding_round': {'id': '12551', 'stage': 'Series C', 'date': '2015-03-05T00:00:00Z', 'amount': '$50M'}}]}"
8857,General Partner at Benchmark,Eric Vishria,Series B,San Francisco Bay Area,San Francisco Bay Area,general_partner,1000000,15000000,8000000,General Partner at Benchmark,,,,,1,Benchmark,,"{'id': '13328', 'company_display_name': 'Benchling', 'total_raised': ['$300M'], 'coinvestor_names': ['William Reed (Spark Capital)', 'Matt Murphy (Menlo Ventures)', 'Brandon Reeves (Lux Capital Management)', 'Mark McLaughlin (Alkeon Capital)', 'Kevin Mahaffey (SNR)', 'Christopher Golda', 'Elad Gil'], 'investor_profile_funding_rounds': [{'id': '69768', 'is_lead': None, 'board_role': None, 'funding_round': {'id': '37565', 'stage': 'Series E', 'date': '2021-04-14T00:00:00Z', 'amount': '$200M'}}, {'id': '63745', 'is_lead': None, 'board_role': None, 'funding_round': {'id': '34997', 'stage': 'Series D', 'date': '2020-05-28T00:00:00Z', 'amount': '$50M'}}, {'id': '63747', 'is_lead': None, 'board_role': None, 'funding_round': {'id': '34994', 'stage': 'Series C', 'date': '2019-07-24T00:00:00Z', 'amount': '$35M'}}, {'id': '46891', 'is_lead': True, 'board_role': None, 'funding_round': {'id': '27084', 'stage': 'Series B', 'date': '2018-06-14T00:00:00Z', 'amount': '$15M'}}]}"
9024,GP at DCM Ventures,Jason Krikorian,Series A,San Francisco Bay Area,"Redwood City, California",general_partner,250000,15000000,5000000,GP at DCM Ventures,,,,,1,DCM,,"{'id': '51995', 'company_display_name': 'BASIS Science', 'total_raised': ['$44M'], 'coinvestor_names': ['Tim Chang (Mayfield)', 'Casper de Clercq (Norwest Venture Partners)', 'Kevin Swan'], 'investor_profile_funding_rounds': [{'id': '47411', 'is_lead': False, 'board_role': None, 'funding_round': {'id': '25144', 'stage': 'Series B', 'date': '2013-10-08T00:00:00Z', 'amount': '$23M'}}, {'id': '47410', 'is_lead': False, 'board_role': None, 'funding_round': {'id': '25143', 'stage': 'Series B', 'date': '2013-03-06T00:00:00Z', 'amount': '$12M'}}, {'id': '47409', 'is_lead': True, 'board_role': None, 'funding_round': {'id': '27181', 'stage': 'Series A', 'date': '2011-03-22T00:00:00Z', 'amount': '$9M'}}]}"
19320,General Partner at BOND,Jay Simons,Series A,"San Francisco, California","San Francisco, California",general_partner,1000000,25000000,8000000,General Partner at BOND,,,,,1,Bond,,"{'id': '14614', 'company_display_name': 'Loom', 'total_raised': ['$210M'], 'coinvestor_names': ['Trevor Oelschig (General Catalyst)', 'David George (Andreessen Horowitz)', 'M.G. Siegler (GV (Google Ventures))', 'Arjun Sethi (Tribe Capital)', 'Brian Balfour (Long Journey Ventures)', 'Lee Jacobs (Long Journey Ventures)', 'Daniel Gross (C2 Investment)', 'Ilya Fushman (Kleiner Perkins)', 'Ben Patterson (Elementum Ventures)', 'Andy Chou (11.2 Capital)', 'Henry McNamara (Great Oaks Venture Capital)', 'Christoph Janz (Point Nine Capital)', 'Mike Krieger', 'Mathilde Collin', 'Dylan Field', 'MG Siegler', 'Yoshinari Yoshikawa', 'Hiten Shah'], 'investor_profile_funding_rounds': [{'id': '75050', 'is_lead': None, 'board_role': None, 'funding_round': {'id': '41356', 'stage': 'Series B', 'date': '2020-05-28T00:00:00Z', 'amount': '$29M'}}]}"
6106,General Partner at Craft Ventures,Jeff Fluhr,Series A,San Francisco Bay Area,"San Francisco, California",general_partner,50000,25000000,12500000,General Partner at Craft Ventures,,,,,1,Craft Ventures,,"{'id': '67020', 'company_display_name': 'Route', 'total_raised': ['$35M'], 'coinvestor_names': ['Tyler Richards (Startup Ignition Ventures)', 'John Richards (Startup Ignition Ventures)', 'Michael Tam (Craft Ventures)', 'Justin Timberlake'], 'investor_profile_funding_rounds': [{'id': '102260', 'is_lead': True, 'board_role': None, 'funding_round': {'id': '53684', 'stage': 'Series A', 'date': '2020-03-01T00:00:00Z', 'amount': '$35M'}}]}"
8864,General Partner at Canaan Partners,John Balen,Seed,"Menlo Park, California","Menlo Park, California",general_partner,250000,20000000,10000000,General Partner at Canaan Partners,,,,,1,Canaan Partners,"{'id': '431', 'name': 'Master of Business Administration (MBA)', 'field_of_study': None, 'school': {'id': '25451', 'name': 'Cornell University', 'display_name': 'Cornell University', 'total_student_count': 82}}","{'id': '15829', 'company_display_name': 'Switchfly', 'total_raised': ['$33M'], 'coinvestor_names': ['Laura B. Sachar (StarVest Partners)', 'Cameron Lester'], 'investor_profile_funding_rounds': [{'id': '14133', 'is_lead': False, 'board_role': {'id': '5784', 'title': 'Member of the Board of Directors'}, 'funding_round': {'id': '4608', 'stage': 'Series C', 'date': '2012-10-12T00:00:00Z', 'amount': '$2.8M'}}, {'id': '14135', 'is_lead': False, 'board_role': {'id': '5784', 'title': 'Member of the Board of Directors'}, 'funding_round': {'id': '4610', 'stage': 'Series C', 'date': '2012-03-01T00:00:00Z', 'amount': '$15M'}}, {'id': '14141', 'is_lead': True, 'board_role': {'id': '5784', 'title': 'Member of the Board of Directors'}, 'funding_round': {'id': '4617', 'stage': 'Series B', 'date': '2007-08-01T00:00:00Z', 'amount': '$15M'}}]}"
11290,Partner & Co-Founder at Yes VC,Jyri Engestrom,Pre-seed,San Francisco Bay Area,"San Francisco, California",general_partner,30000,1500000,250000,Partner & Co-Founder at Yes VC,,,,,1,Yes VC,,"{'id': '19865', 'company_display_name': 'appbackr', 'total_raised': ['$600K'], 'coinvestor_names': [], 'investor_profile_funding_rounds': [{'id': '51325', 'is_lead': False, 'board_role': None, 'funding_round': {'id': '29319', 'stage': 'Seed Round', 'date': '2010-07-22T00:00:00Z', 'amount': '$600K'}}]}"
12255,General Partner at A.Capital Venture,Kartik Talwar,Series A,San Francisco Bay Area,"San Francisco, California",general_partner,100000,10000000,1000000,General Partner at A.Capital Venture,,,,,1,A Capital,,"{'id': '58671', 'company_display_name': 'Iron Fish', 'total_raised': ['$33M'], 'coinvestor_names': ['John Lilly (Greylock)', 'Jill Carlson (Slow Ventures)', 'Jack Abraham (Atomic)', 'Naval Ravikant (The Hit Forge)', 'Linda Xie (Scalar Capital)', 'Do Kwon', 'Jack Chou'], 'investor_profile_funding_rounds': [{'id': '73303', 'is_lead': None, 'board_role': None, 'funding_round': {'id': '39145', 'stage': 'Seed Round', 'date': '2021-04-06T00:00:00Z', 'amount': '$5.3M'}}]}"
5763,General Partner at InterWest Partners,Keval Desai,Series A,"San Francisco, California","San Francisco, California",general_partner,100000,5000000,1500000,General Partner at InterWest Partners,,,,,1,InterWest,"{'id': '2787', 'name': 'MBA', 'field_of_study': None, 'school': {'id': '27260', 'name': 'University of California, Berkeley - Walter A. Haas School of Business', 'display_name': 'University of California, Berkeley - Walter A. Haas School of Business', 'total_student_count': 46}}","{'id': '10491', 'company_display_name': 'Ribbon', 'total_raised': ['£2.6M', '$230M'], 'coinvestor_names': ['Pete Flint (NFX)', 'James Currier (NFX)', 'Karan Mehta (Octopus Ventures)', 'Thomas Korte (AngelPad)', 'Carine Magescas (AngelPad)', 'Joel Yarmon (Pipeline Capital Partners)', 'Greg Kidd'], 'investor_profile_funding_rounds': [{'id': '106327', 'is_lead': None, 'board_role': None, 'funding_round': {'id': '58883', 'stage': 'Pre Seed Round', 'date': '2011-09-01T00:00:00Z', 'amount': '$120K'}}, {'id': '16044', 'is_lead': False, 'board_role': None, 'funding_round': {'id': '11558', 'stage': 'Angel Round', 'date': '2011-09-01T00:00:00Z', 'amount': '$120K'}}]}"
8860,General Partner at Benchmark Capital,Kevin Harvey,Series B,San Francisco Bay Area,"Menlo Park, California",general_partner,1000000,15000000,8000000,General Partner at Benchmark Capital,,,,,1,Benchmark,,"{'id': '44357', 'company_display_name': 'Qlusters', 'total_raised': ['$26M'], 'coinvestor_names': ['John Cadeddu (DAG Ventures)'], 'investor_profile_funding_rounds': [{'id': '16209', 'is_lead': False, 'board_role': None, 'funding_round': {'id': '10489', 'stage': 'Series C', 'date': '2007-08-08T00:00:00Z', 'amount': '$10M'}}]}"
