id,headline,person,stages,investment_locations,location,position,min_investment,max_investment,target_investment,headline,previous_position,previous_firm,areas_of_interest_freeform,no_current_interest_freeform,vote_count,firm,degrees,investments_on_record
17331,General Partner at Coatue Management,Caryn Marooney,Seed,San Francisco Bay Area,San Francisco Bay Area,general_partner,250000,4000000,2125000,General Partner at Coatue Management,,,,,0,Coatue,,"{'id': '59771', 'company_display_name': 'ClickHouse', 'total_raised': ['$300M'], 'coinvestor_names': ['Peter Fenton (Benchmark)', 'Mike Volpi (Index Ventures)', 'Kevin Wang (Altimeter Capital)'], 'investor_profile_funding_rounds': [{'id': '124426', 'is_lead': True, 'board_role': None, 'funding_round': {'id': '50757', 'stage': 'Series B', 'date': '2021-10-28T00:00:00Z', 'amount': '$250M'}}]}"
9722,General Partner at U.S. Venture Partners,Casey Tansey,Seed,"Menlo Park, California","Menlo Park, California",general_partner,2000000,10000000,6000000,General Partner at U.S. Venture Partners,,,,,0,U.S. Venture Partners (USVP),,"{'id': '41854', 'company_display_name': 'Inspire Medical Systems', 'total_raised': ['$110M'], 'coinvestor_names': ['Joyce Erony (Amzak Health Investors)'], 'investor_profile_funding_rounds': [{'id': '141096', 'is_lead': None, 'board_role': {'id': '2255', 'title': 'Board Director'}, 'funding_round': {'id': '59627', 'stage': 'Series F', 'date': '2016-11-18T00:00:00Z', 'amount': '$38M'}}, {'id': '5459', 'is_lead': False, 'board_role': {'id': '2255', 'title': 'Board Director'}, 'funding_round': {'id': '4759', 'stage': 'Series E', 'date': '2014-05-15T00:00:00Z', 'amount': '$40M'}}, {'id': '5464', 'is_lead': False, 'board_role': {'id': '2255', 'title': 'Board Director'}, 'funding_round': {'id': '4763', 'stage': 'Series C', 'date': '2012-05-11T00:00:00Z', 'amount': '$15M'}}, {'id': '5468', 'is_lead': False, 'board_role': {'id': '2255', 'title': 'Board Director'}, 'funding_round': {'id': '4765', 'stage': 'Series B', 'date': '2009-06-29T00:00:00Z', 'amount': '$17M'}}]}"
19963,Founder of Au21 Capital,Chandler Guo,Series A,"San Francisco, California",Beijing,general_partner,100000,10000000,1000000,Founder of Au21 Capital,,,,,0,AU21 Capital,,"{'id': '60728', 'company_display_name': 'AiLink', 'total_raised': [], 'coinvestor_names': [], 'investor_profile_funding_rounds': [{'id': '77057', 'is_lead': None, 'board_role': None, 'funding_round': {'id': '42426', 'stage': 'Venture Round', 'date': '2018-03-06T00:00:00Z', 'amount': '0'}}]}"
22660,General Partner at Paradigm,Charlie Noyes,Series A,"San Francisco, California","San Francisco, California",general_partner,1000000,100000000,25000000,General Partner at Paradigm,,,,,0,Paradigm,,"{'id': '60050', 'company_display_name': 'Euler', 'total_raised': ['$40M'], 'coinvestor_names': ['Josh Buckley (Buckley Ventures)', 'Katie Haun (Haun Ventures)', 'David Hoffman'], 'investor_profile_funding_rounds': [{'id': '85005', 'is_lead': True, 'board_role': None, 'funding_round': {'id': '41708', 'stage': 'Series A', 'date': '2021-08-25T00:00:00Z', 'amount': '$8M'}}]}"
29796,Managing General Partner at Rain Capital,Chenxi Wang,Series A,San Francisco Bay Area,San Francisco Bay Area,general_partner,100000,5000000,1500000,Managing General Partner at Rain Capital,,,,,0,Rain Capital,,"{'id': '51372', 'company_display_name': 'Miles', 'total_raised': ['$17M'], 'coinvestor_names': ['Shaun Abrahamson (Third Sphere)', 'Stonly Baptiste Blue (Third Sphere)', 'Tak Miyata (Scrum Ventures)', 'Gabe Klein (Fontinalis Partners)', 'Keith Teare (Archimedes Accelerator LLC)', 'Harris Barton', 'Ashish Toshniwal'], 'investor_profile_funding_rounds': [{'id': '99665', 'is_lead': None, 'board_role': None, 'funding_round': {'id': '55088', 'stage': 'Series A', 'date': '2021-07-21T00:00:00Z', 'amount': '$13M'}}]}"
47853,General Partner at Mouro Capital,Chris Gottschalk,Series B,San Francisco Bay Area,"San Francisco, California",general_partner,1000000,15000000,5000000,General Partner at Mouro Capital,,,,,0,Mouro Capital,,"{'id': '79885', 'company_display_name': 'nocnoc', 'total_raised': ['$7M'], 'coinvestor_names': [], 'investor_profile_funding_rounds': [{'id': '139337', 'is_lead': True, 'board_role': None, 'funding_round': {'id': '75644', 'stage': 'Seed Round', 'date': '2022-03-22T00:00:00Z', 'amount': '$7M'}}]}"
12755,General Partner at Root Ventures,Chrissy Meyer,Series A,"San Francisco, California","San Francisco, California",general_partner,500000,2000000,1000000,General Partner at Root Ventures,,,,,0,Root Ventures,,"{'id': '59100', 'company_display_name': 'ChargeLab', 'total_raised': ['$20M'], 'coinvestor_names': ['Shaun Abrahamson (Third Sphere)', 'Stonly Baptiste Blue (Third Sphere)', 'Andre Charoo (iNovia Capital)', 'Kane Hsieh (Root Ventures)'], 'investor_profile_funding_rounds': [{'id': '116202', 'is_lead': None, 'board_role': None, 'funding_round': {'id': '60845', 'stage': 'Series A', 'date': '2022-05-19T00:00:00Z', 'amount': '$15M'}}, {'id': '116201', 'is_lead': True, 'board_role': None, 'funding_round': {'id': '60844', 'stage': 'Seed Round', 'date': '2021-02-23T00:00:00Z', 'amount': '$4.3M'}}]}"
15580,General Partner at Lowercarbon Capital,Clay Dumas,Seed,San Francisco Bay Area,"Los Angeles, California",general_partner,100000,3000000,1000000,General Partner at Lowercarbon Capital,,,,,0,Lowercarbon Capital,,"{'id': '57507', 'company_display_name': 'Pledge', 'total_raised': ['£8M', '$12M'], 'coinvestor_names': ['Mark Mullen (Bonfire Ventures)', 'Robert Lacher (La Famiglia)', 'Sara Thomas Deshpande (Maven Ventures)', 'Jon Soberg (MS&AD Ventures)'], 'investor_profile_funding_rounds': [{'id': '140364', 'is_lead': None, 'board_role': None, 'funding_round': {'id': '76046', 'stage': 'Series A', 'date': '2023-05-16T00:00:00Z', 'amount': '£8M'}}]}"
8281,General Partner at BOND,Daegwon Chae,Series A,San Francisco Bay Area,"San Francisco, California",general_partner,1000000,25000000,8000000,General Partner at BOND,,,,,0,Bond,"{'id': '6642', 'name': None, 'field_of_study': None, 'school': {'id': '25445', 'name': 'Dartmouth College', 'display_name': 'Dartmouth College', 'total_student_count': 54}}","{'id': '58170', 'company_display_name': 'Flink Food', 'total_raised': ['$1B'], 'coinvestor_names': ['Jessica Schultz (Northzone)', 'Christian Meermann (Cherry Ventures)', 'LVL1 Group (LVL1 Group)'], 'investor_profile_funding_rounds': [{'id': '68368', 'is_lead': True, 'board_role': None, 'funding_round': {'id': '38060', 'stage': 'Series A', 'date': '2021-06-03T00:00:00Z', 'amount': '$240M'}}]}"
40794,General Partner and the Head of Research at Paradigm,Daniel Robinson,Series A,San Francisco Bay Area,"San Francisco, California",general_partner,1000000,100000000,25000000,General Partner and the Head of Research at Paradigm,,,,,0,Paradigm,,"{'id': '74731', 'company_display_name': 'AI Arena', 'total_raised': ['$5M'], 'coinvestor_names': [], 'investor_profile_funding_rounds': [{'id': '121698', 'is_lead': True, 'board_role': None, 'funding_round': {'id': '67089', 'stage': 'Seed Round', 'date': '2021-10-27T00:00:00Z', 'amount': '$5M'}}]}"
15704,General Partner at Greylock,David Thacker,Series A,San Francisco Bay Area,San Francisco Bay Area,general_partner,500000,200000000,25000000,General Partner at Greylock,,,,,0,Greylock,"{'id': '11603', 'name': 'MBA', 'field_of_study': 'General Management', 'school': {'id': '25192', 'name': 'Harvard Business School', 'display_name': 'Harvard Business School', 'total_student_count': 310}}","{'id': '52252', 'company_display_name': 'Curated', 'total_raised': ['$140M'], 'coinvestor_names': ['Kirsten Green (Forerunner Ventures)', 'Laela Sturdy (CapitalG)', 'Alex Nichols (CapitalG)'], 'investor_profile_funding_rounds': [{'id': '136886', 'is_lead': None, 'board_role': None, 'funding_round': {'id': '74431', 'stage': 'Series B', 'date': '2021-04-01T00:00:00Z', 'amount': '$39M'}}]}"
18104,"General at Lux Capital; Previously GV, Google, State Dept",Deena Shakir,Series A,"New York, New York",San Francisco Bay Area,general_partner,500000,50000000,25000000,"General at Lux Capital; Previously GV, Google, State Dept",,,,,0,Lux Capital Management,,"{'id': '50616', 'company_display_name': 'Mos', 'total_raised': ['$57M'], 'coinvestor_names': ['Jess Lee (Sequoia Capital)', 'Steph Curry (Penny Jar Capital)', 'Kevin Mahaffey (SNR)', 'Filip Dames (Cherry Ventures)', 'John Doerr (Kleiner Perkins)', 'Garrett Camp (Expa)', 'Christian Dorffer (Sweet Capital)', 'Pippa Lamb (Sweet Capital)', 'Naveen Selvadurai', 'Khaled Helioui', 'Ash Pournouri'], 'investor_profile_funding_rounds': [{'id': '99230', 'is_lead': None, 'board_role': None, 'funding_round': {'id': '54872', 'stage': 'Series B', 'date': '2022-02-03T00:00:00Z', 'amount': '$40M'}}]}"
37246,General Partner at CapitalG,Derek Zanutto,Series B,"San Francisco, California",San Francisco Bay Area,general_partner,100000,5000000,1500000,General Partner at CapitalG,,,,,0,CapitalG,,"{'id': '42656', 'company_display_name': 'Collibra', 'total_raised': ['$590M', '€1M'], 'coinvestor_names': ['Jan Hammer (Index Ventures)', 'Dharmesh Thakker (Battery Ventures)', 'Patrick Polak (Newion Investments)', 'Norman Fiore (Dawn Capital)'], 'investor_profile_funding_rounds': [{'id': '114157', 'is_lead': None, 'board_role': None, 'funding_round': {'id': '46354', 'stage': 'Series G', 'date': '2021-11-09T00:00:00Z', 'amount': '$250M'}}, {'id': '114153', 'is_lead': None, 'board_role': None, 'funding_round': {'id': '44621', 'stage': 'Series F', 'date': '2020-04-02T00:00:00Z', 'amount': '$110M'}}, {'id': '114151', 'is_lead': True, 'board_role': None, 'funding_round': {'id': '44623', 'stage': 'Series E', 'date': '2019-01-29T00:00:00Z', 'amount': '$100M'}}]}"
8599,General Partner at Battery Ventures,Dharmesh Thakker,Series A,San Francisco Bay Area,"Menlo Park, California",general_partner,250000,60000000,20000000,General Partner at Battery Ventures,,,,,0,Battery Ventures,"{'id': '1999', 'name': 'MBA', 'field_of_study': None, 'school': {'id': '25427', 'name': 'The Wharton School', 'display_name': 'The Wharton School', 'total_student_count': 69}}","{'id': '42655', 'company_display_name': 'Sensu', 'total_raised': ['$10M'], 'coinvestor_names': [], 'investor_profile_funding_rounds': [{'id': '8377', 'is_lead': True, 'board_role': {'id': '3376', 'title': 'Member of the Board of Directors'}, 'funding_round': {'id': '6777', 'stage': 'Series A', 'date': '2018-04-13T00:00:00Z', 'amount': '$10M'}}]}"
38930,Co-Founder & General Partner at Impact Venture Capital,Eric Ball,Series A,"Menlo Park, California","Menlo Park, California",general_partner,500000,2500000,1500000,Co-Founder & General Partner at Impact Venture Capital,,,,,0,Impact VC,,"{'id': '57026', 'company_display_name': 'Syntegra', 'total_raised': ['$5.6M'], 'coinvestor_names': ['Anne Dwane (Village Global)'], 'investor_profile_funding_rounds': [{'id': '117420', 'is_lead': None, 'board_role': None, 'funding_round': {'id': '35727', 'stage': 'Seed Round', 'date': '2020-08-28T00:00:00Z', 'amount': '$5.6M'}}]}"
15677,Founding Partner at Innovation Endeavors,Eric Schmidt,Seed,San Francisco Bay Area,"New York, New York",general_partner,100000,10000000,5000000,Founding Partner at Innovation Endeavors,,,,,0,Innovation Endeavors,,"{'id': '16363', 'company_display_name': 'Beacon', 'total_raised': ['$73M'], 'coinvestor_names': ['Jake Medwell (8VC)', 'Garrett Camp (Expa)', 'Neil Chheda (Romulus Capital)', 'Marc Benioff', 'Jeff Bezos'], 'investor_profile_funding_rounds': [{'id': '115982', 'is_lead': None, 'board_role': None, 'funding_round': {'id': '63530', 'stage': 'Series A', 'date': '2020-06-01T00:00:00Z', 'amount': '$15M'}}]}"
15642,,Eric  Wiesen ,Post-seed,San Francisco Bay Area,,general_partner,1000000,3000000,2000000,,,,,,0,Bullpen Capital,,"{'id': '47226', 'company_display_name': 'Solvate', 'total_raised': ['$6.3M'], 'coinvestor_names': ['Thatcher Bell'], 'investor_profile_funding_rounds': [{'id': '102231', 'is_lead': None, 'board_role': None, 'funding_round': {'id': '16926', 'stage': 'Series B', 'date': '2011-02-15T00:00:00Z', 'amount': '$4M'}}, {'id': '102224', 'is_lead': True, 'board_role': None, 'funding_round': {'id': '16927', 'stage': 'Series A', 'date': '2009-08-28T00:00:00Z', 'amount': '$2.3M'}}]}"
21933,General Partner  at 468 Capital,Florian Leibert,Seed,San Francisco Bay Area,"San Francisco, California",general_partner,100000,1500000,1500000,General Partner  at 468 Capital,,,,,0,468 Capital,,"{'id': '71516', 'company_display_name': 'DIDIT', 'total_raised': ['€2M'], 'coinvestor_names': [], 'investor_profile_funding_rounds': [{'id': '111665', 'is_lead': None, 'board_role': None, 'funding_round': {'id': '61565', 'stage': 'Pre Seed Round', 'date': '2020-02-15T00:00:00Z', 'amount': '€2M'}}]}"
14402,General Partner at WestWave Capital,Gaurav Manglik,Pre-seed,San Francisco Bay Area,"Palo Alto, California",general_partner,250000,3000000,1000000,General Partner at WestWave Capital,,,,,0,WestWave Capital,,"{'id': '70051', 'company_display_name': 'Orkus', 'total_raised': [], 'coinvestor_names': ['Warren Weiss (WestWave Capital)'], 'investor_profile_funding_rounds': [{'id': '106646', 'is_lead': None, 'board_role': None, 'funding_round': {'id': '59042', 'stage': 'Convertible Note', 'date': '2019-09-16T00:00:00Z', 'amount': '0'}}, {'id': '106641', 'is_lead': None, 'board_role': None, 'funding_round': {'id': '59023', 'stage': 'Seed Round', 'date': '2017-12-20T00:00:00Z', 'amount': '0'}}]}"
49167,Co-Founder and General Partner A*,Gautam Gupta,Series A,"San Francisco, California","San Francisco, California",general_partner,100000,10000000,3000000,Co-Founder and General Partner A*,,,,,0,A* Capital (A Star Capitail),,"{'id': '65621', 'company_display_name': 'Fonoa', 'total_raised': ['$21M'], 'coinvestor_names': ['Kevin Hartz (A* Capital (A Star Capitail))', 'Cleo Sham (Stride VC)', 'Jambu Palaniappan (OMERS Ventures)', 'Mandeep Singh'], 'investor_profile_funding_rounds': [{'id': '141704', 'is_lead': None, 'board_role': None, 'funding_round': {'id': '50956', 'stage': 'Series A', 'date': '2021-11-22T00:00:00Z', 'amount': '$21M'}}]}"
37231,General Partner at CapitalG,Gene Frantz,Series B,"San Francisco, California","San Francisco, California",general_partner,100000,5000000,1500000,General Partner at CapitalG,,,,,0,CapitalG,,"{'id': '40061', 'company_display_name': 'Expel', 'total_raised': ['$290M'], 'coinvestor_names': ['Ariel Tseitlin (Scale Venture Partners)', 'Shardul Shah (Index Ventures)', 'Jed Leidheiser (March Capital)', 'Ellie Wheeler (Greycroft)', 'Rick Zullo (Equal Ventures)', 'Abhi Arunachalam (Alkeon Capital)', 'Mourad Yesayan (Paladin Capital Group)'], 'investor_profile_funding_rounds': [{'id': '121084', 'is_lead': True, 'board_role': None, 'funding_round': {'id': '66584', 'stage': 'Series E', 'date': '2022-10-03T00:00:00Z', 'amount': '$31M'}}, {'id': '114115', 'is_lead': True, 'board_role': None, 'funding_round': {'id': '60616', 'stage': 'Series E', 'date': '2021-11-18T00:00:00Z', 'amount': '$140M'}}, {'id': '114112', 'is_lead': True, 'board_role': None, 'funding_round': {'id': '60615', 'stage': 'Series D', 'date': '2020-05-13T00:00:00Z', 'amount': '$50M'}}]}"
8304,General Partner at GV,Graham Spencer,Seed,"Palo Alto, California","Palo Alto, California",general_partner,250000,50000000,25000000,General Partner at GV,,,,,0,GV (Google Ventures),,"{'id': '15242', 'company_display_name': 'InfraSearch', 'total_raised': ['$2M'], 'coinvestor_names': ['Marc Andreessen (Andreessen Horowitz)', 'Joe Kraus (GV (Google Ventures))'], 'investor_profile_funding_rounds': [{'id': '11171', 'is_lead': False, 'board_role': None, 'funding_round': {'id': '8629', 'stage': 'Angel Round', 'date': '2000-06-30T00:00:00Z', 'amount': '$2M'}}]}"
9445,General Partner at ValueStream Ventures,Greg Neufeld,Post-seed,"New York, New York","Delray Beach, Florida",general_partner,500000,4000000,2000000,General Partner at ValueStream Ventures,,,,,0,ValueStream Ventures,,"{'id': '16741', 'company_display_name': 'Estimize', 'total_raised': ['$1.2M'], 'coinvestor_names': [], 'investor_profile_funding_rounds': [{'id': '11329', 'is_lead': False, 'board_role': None, 'funding_round': {'id': '8734', 'stage': 'Series A', 'date': '2014-03-26T00:00:00Z', 'amount': '$1.2M'}}]}"
17144,General Partner at Eclipse Ventures,Greg Reichow,Seed,San Francisco Bay Area,San Francisco Bay Area,general_partner,200000,5000000,2500000,General Partner at Eclipse Ventures,,,,,0,Eclipse Ventures,,"{'id': '67825', 'company_display_name': 'Arc Boats', 'total_raised': ['$30M'], 'coinvestor_names': ['Chris Sacca (Lowercarbon Capital)', 'Kevin Durant (Thirty Five Ventures)', 'Ramtin Naimi (Abstract Ventures)'], 'investor_profile_funding_rounds': [{'id': '106897', 'is_lead': True, 'board_role': None, 'funding_round': {'id': '55071', 'stage': 'Series A', 'date': '2021-11-23T00:00:00Z', 'amount': '$30M'}}]}"
27106,Founder at Rally Cap Ventures;  VENTURE PARTNER @ Lateral Frontiers,Hayden Simmons,Series A,"San Francisco, California","San Francisco, California",general_partner,100000,5000000,1500000,Founder at Rally Cap Ventures;  VENTURE PARTNER @ Lateral Frontiers,,,,,0,rali_cap,,"{'id': '66443', 'company_display_name': 'Frain technologies', 'total_raised': ['$470K'], 'coinvestor_names': [], 'investor_profile_funding_rounds': [{'id': '94979', 'is_lead': True, 'board_role': None, 'funding_round': {'id': '52585', 'stage': 'Pre Seed Round', 'date': '2022-01-19T00:00:00Z', 'amount': '$470K'}}]}"
42483,General Partner at Carbide Ventures,Hiro Yoshikawa,Series A,"Palo Alto, California",San Francisco Bay Area,general_partner,100000,5000000,1500000,General Partner at Carbide Ventures,,,,,0,Carbide Ventures,,"{'id': '58736', 'company_display_name': 'HOMMA', 'total_raised': ['$19M'], 'coinvestor_names': ['Hiro Rio Maeda (DNX Ventures)', 'Ryo Ishizuka (Alliance of Angels)'], 'investor_profile_funding_rounds': [{'id': '130985', 'is_lead': None, 'board_role': None, 'funding_round': {'id': '71630', 'stage': 'Convertible Note', 'date': '2019-04-23T00:00:00Z', 'amount': '$6.5M'}}]}"
8593,Founder and General Partner at Cortical Ventures,Igor Taber,Series A,San Francisco Bay Area,San Francisco Bay Area,general_partner,100000,5000000,1500000,Founder and General Partner at Cortical Ventures,,,,,0,Cortical Ventures,,"{'id': '23008', 'company_display_name': 'Paxata', 'total_raised': ['$60M'], 'coinvestor_names': ['Dinesh Katiyar (Accel)'], 'investor_profile_funding_rounds': [{'id': '11995', 'is_lead': True, 'board_role': {'id': '4742', 'title': 'Board Member'}, 'funding_round': {'id': '6794', 'stage': 'Series D', 'date': '2016-10-24T00:00:00Z', 'amount': '$34M'}}]}"
36525,General Partner at Peterson Ventures,Ilana Stern,Post-seed,San Francisco Bay Area,San Francisco Bay Area,general_partner,250000,2500000,1400000,General Partner at Peterson Ventures,,,,,0,Peterson Ventures,,"{'id': '40383', 'company_display_name': 'Grain', 'total_raised': ['$34M', 'SGD2.5M'], 'coinvestor_names': ['Micah Rosenbloom (Founder Collective)', 'Guillaume Cabane (Sequoia Capital)', 'Alireza Masrour (Plug & Play Ventures)', 'Lauren Kolodny (aCrew Capital)', 'Scooter Braun (TQ Ventures)', 'Dalton Wright (Kickstart Fund)', 'Eyal Gura (Webtalk Ltd)', 'Ozi Amanat (K2 Global)', 'Sandhya Hegde (Unusual Ventures)', 'Shane Mac (Logos Labs)', 'John Curtius (Cedar Capital Group)', 'Brian Balfour (Long Journey Ventures)', 'Andreas Klinger (Remote First Capital)', 'Asad Khaliq (aCrew Capital)', 'Sriram Krishnan (Kearny Jackson)', 'Vishal Harnal (500 Global)', 'Gabriel Jarrosson', 'Scott Belsky', 'Sahil Lavingia'], 'investor_profile_funding_rounds': [{'id': '111925', 'is_lead': True, 'board_role': None, 'funding_round': {'id': '61748', 'stage': 'Seed Round', 'date': '2020-04-07T00:00:00Z', 'amount': '$4M'}}]}"
26353,General Partner at SID Venture Partners,Illia Polosukhin,Series A,"Mountain View, California","Mountain View, California",general_partner,100000,5000000,1500000,General Partner at SID Venture Partners,,,,,0,SID Venture Partners,,"{'id': '58486', 'company_display_name': 'Syndicate', 'total_raised': ['$28M'], 'coinvestor_names': ['Morgan Beller (NFX)', 'Ali Yahya (Andreessen Horowitz)', 'Courtney Chow (Battery Ventures)', 'Niraj Pant (Polychain Capital)', 'Avichal Garg (Electric Capital)', 'Curtis Spencer (Electric Capital)', 'Ken Deeter (Electric Capital)', 'Maria Shen (Electric Capital)', 'Alexis Ohanian (Seven Seven Six)', 'David Eckstein (Sequoia Capital)', 'Boris Wertz (Version One Ventures)', 'Cooper Turley (Variant (variant.fund))', 'Li Jin (Variant (variant.fund))', 'Matthew Ball (Makers Fund)', 'Baek Kim (Hashed)', 'Lenny Rachitsky (AirAngels)', 'Tom Shaughnessy Jr (Seed Club Ventures)', 'Joyce Yang (Seed Club Ventures)', 'Joon Ian Wong (Seed Club Ventures)', 'Erikan Obotetukudo (Audacity)', 'Gabby Dizon (Infinity Ventures Crypto)', 'Sriram Krishnan (Kearny Jackson)', 'Min Teo (Ethereal Ventures)', 'Julia Lipton (Awesome People Ventures)', 'George Lambeth (Divergence Ventures)', 'Calvin Liu (Divergence Ventures)', ""Rahul Vohra (Todd and Rahul's Angel Fund)"", ""Todd Goldberg (Todd and Rahul's Angel Fund)"", 'Jeff Morris, Jr. (Chapter One Ventures)', 'Ryan Junee (Electric Ant)', 'Packy McCormick (Not Boring Capital)', 'Ashton Kutcher (Sound Ventures)', 'Ryan Hoover (Weekend Fund)', 'Evan Feng (CoinFund)', 'Jake Brukhman (CoinFund)', 'Alexander Pack (Hack VC)', 'Dan Elitzer (Nascent)', 'Tarun Chitra (Robot Ventures)', 'Robert Leshner (Robot Ventures)', 'Ash Egan (Archetype)', 'Monica Desai Weiss (Kleiner Perkins)', 'Rene Reinsberg', 'Do Kwon', 'Luis Cuende', 'Alice Lloyd George', 'Scott Belsky', 'Adam Jackson', 'Tegan Kline', 'Trevor McFedries', 'Tyler Scott Ward', 'Imran Khan', 'Brad Holden', 'Andrew Steinwold', 'Anastasia Andrianova', 'Regan Bozman'], 'investor_profile_funding_rounds': [{'id': '92943', 'is_lead': None, 'board_role': None, 'funding_round': {'id': '41624', 'stage': 'Seed Round', 'date': '2021-06-30T00:00:00Z', 'amount': '$800K'}}]}"
38924,Founding General Partner at Impact Venture Capital,Jack Crawford,Series C,"Sacramento, California","Sacramento, California",general_partner,500000,2500000,1500000,Founding General Partner at Impact Venture Capital,,,,,0,Impact VC,,"{'id': '73623', 'company_display_name': 'TaskHuman', 'total_raised': ['$33M'], 'coinvestor_names': ['Rick Lewis (U.S. Venture Partners (USVP))'], 'investor_profile_funding_rounds': [{'id': '117427', 'is_lead': None, 'board_role': None, 'funding_round': {'id': '64807', 'stage': 'Series B', 'date': '2022-06-21T00:00:00Z', 'amount': '$20M'}}, {'id': '117423', 'is_lead': True, 'board_role': None, 'funding_round': {'id': '64803', 'stage': 'Seed Round', 'date': '2020-06-17T00:00:00Z', 'amount': '$3M'}}]}"
23027,General Partner and Portfolio Manager at Frazier Healthcare Partners,James W. Brush,Series B,San Francisco Bay Area,"Menlo Park, California",general_partner,100000,5000000,1500000,General Partner and Portfolio Manager at Frazier Healthcare Partners,,,,,0,Frazier Healthcare Partners,,"{'id': '64054', 'company_display_name': 'Amunix', 'total_raised': ['$190M'], 'coinvestor_names': [], 'investor_profile_funding_rounds': [{'id': '87575', 'is_lead': None, 'board_role': None, 'funding_round': {'id': '48334', 'stage': 'Series B', 'date': '2021-03-04T00:00:00Z', 'amount': '$120M'}}, {'id': '87576', 'is_lead': None, 'board_role': None, 'funding_round': {'id': '48335', 'stage': 'Series A', 'date': '2020-03-04T00:00:00Z', 'amount': '$73M'}}]}"
9731,General Partner at Lightstone Ventures,Jason Lettmann,Series B,"Dublin, Ireland","Menlo Park, California",general_partner,100000,5000000,1500000,General Partner at Lightstone Ventures,,,,,0,Morgenthaler Ventures,"{'id': '62', 'name': 'MBA', 'field_of_study': None, 'school': {'id': '25353', 'name': 'University of Michigan - Stephen M. Ross School of Business', 'display_name': 'University of Michigan - Stephen M. Ross School of Business', 'total_student_count': 28}}","{'id': '21705', 'company_display_name': 'Second Genome', 'total_raised': ['$100M'], 'coinvestor_names': ['Mike Carusi (Lightstone Ventures)'], 'investor_profile_funding_rounds': [{'id': '12580', 'is_lead': False, 'board_role': {'id': '5074', 'title': 'Board Member'}, 'funding_round': {'id': '9501', 'stage': 'Series B', 'date': '2016-04-20T00:00:00Z', 'amount': '$43M'}}, {'id': '87140', 'is_lead': None, 'board_role': {'id': '5074', 'title': 'Board Member'}, 'funding_round': {'id': '48060', 'stage': 'Series B', 'date': '2016-04-13T00:00:00Z', 'amount': '$51M'}}, {'id': '12583', 'is_lead': False, 'board_role': {'id': '5074', 'title': 'Board Member'}, 'funding_round': {'id': '9504', 'stage': 'Series A', 'date': '2013-06-05T00:00:00Z', 'amount': '$6.5M'}}]}"
