id,headline,person,stages,investment_locations,location,position,min_investment,max_investment,target_investment,headline,previous_position,previous_firm,areas_of_interest_freeform,no_current_interest_freeform,vote_count,firm,degrees,investments_on_record
13210,,Ed Walters,Pre-seed,New York City,New York City,general_partner,100000,1500000,750000,,,,"I'm incredibly interested in real estate technology. Right now, I'm exploring  the intersection of healthcare, wellness, digital technology and real estate.",I just can't get excited about new brokerage models or pure fintech.,4,Tamarisc Ventures,"{'id': '7280', 'name': 'MBA', 'field_of_study': None, 'school': {'id': '25192', 'name': 'Harvard Business School', 'display_name': 'Harvard Business School', 'total_student_count': 310}}","{'id': '19274', 'company_display_name': 'Bevi', 'total_raised': ['$59M'], 'coinvestor_names': ['Patricia Nakache (Trinity Ventures)', 'Ed Walters (Allegory)', 'William Hapworth'], 'investor_profile_funding_rounds': [{'id': '32257', 'is_lead': False, 'board_role': None, 'funding_round': {'id': '18603', 'stage': 'Series B', 'date': '2017-07-13T00:00:00Z', 'amount': '$17M'}}]}"
9170,General Partner at Floodgate,Arjun Chopra,Seed,Global,"San Francisco, California",general_partner,500000,5000000,2500000,General Partner at Floodgate,,,"API, Automation, Cloud, Fintech, Future of Work, Internet and Mobile, Marketplace, Productivity, Proptech/Real Estate, SaaS, Social, Supply Chain/Logistics, Transportation, Travel/Hospitality",,7,Floodgate,"{'id': '860', 'name': 'MBA', 'field_of_study': None, 'school': {'id': '25192', 'name': 'Harvard Business School', 'display_name': 'Harvard Business School', 'total_student_count': 310}}","{'id': '59611', 'company_display_name': 'Blooma', 'total_raised': ['$2.8M'], 'coinvestor_names': [], 'investor_profile_funding_rounds': [{'id': '73802', 'is_lead': True, 'board_role': None, 'funding_round': {'id': '40770', 'stage': 'Seed Round', 'date': '2019-08-20T00:00:00Z', 'amount': '$2.8M'}}]}"
5350,Co-Founder & General Partner at Andreessen Horowitz,Marc Andreessen,Series C,"Mountain View, California","Mountain View, California",general_partner,500000,40000000,20000000,Co-Founder & General Partner at Andreessen Horowitz,,,,,27,Andreessen Horowitz,"{'id': '6597', 'name': 'Bachelor of Science', 'field_of_study': 'Computer Science', 'school': {'id': '25207', 'name': 'University of Illinois at Urbana-Champaign', 'display_name': 'University of Illinois at Urbana-Champaign', 'total_student_count': 46}}","{'id': '45064', 'company_display_name': 'SkillsVillage', 'total_raised': ['$17M'], 'coinvestor_names': [], 'investor_profile_funding_rounds': [{'id': '17075', 'is_lead': False, 'board_role': None, 'funding_round': {'id': '12109', 'stage': 'Series B', 'date': '2000-04-26T00:00:00Z', 'amount': '$17M'}}]}"
15293,General Partner at Greylock,Mike Duboe,Seed,"San Francisco, California","San Francisco, California",general_partner,500000,200000000,25000000,General Partner at Greylock,,,,,1,Greylock,,"{'id': '52763', 'company_display_name': 'Postscript', 'total_raised': ['$110M'], 'coinvestor_names': ['Ramy Adeeb (1984 Ventures)', 'Sarah Guo (Conviction Partners)', 'Dick Costolo (01 Advisors)', 'Jonathan Shriftman (Expanding Capital)', 'Drew Leahy (Hawke Ventures)', 'Brendan Rempel (Fractal Software)', 'Elias Torres (The Community Fund)', 'Andrew Bialecki', 'Eric Rea', 'Mathilde Collin', 'Dennis Steele'], 'investor_profile_funding_rounds': [{'id': '110055', 'is_lead': None, 'board_role': None, 'funding_round': {'id': '60673', 'stage': 'Series C', 'date': '2022-06-15T00:00:00Z', 'amount': '$65M'}}, {'id': '65594', 'is_lead': True, 'board_role': None, 'funding_round': {'id': '36604', 'stage': 'Series B', 'date': '2021-03-03T00:00:00Z', 'amount': '$35M'}}]}"
13660,Early Stage Enterprise / Deep Tech Investor,Baris Aksoy,Post-seed,San Francisco Bay Area,"Palo Alto, California",general_partner,500000,5000000,2000000,Early Stage Enterprise / Deep Tech Investor,,,"Data infrastructure/security. 
ML/AI stack.
Vertical applications/SaaS.
Autonomous solutions.",Consumer. Ecommerce. Blockchain. Biotech.,3,AV8 Ventures,"{'id': '8314', 'name': 'MBA', 'field_of_study': '', 'school': {'id': '25213', 'name': 'University of Pennsylvania - The Wharton School', 'display_name': 'University of Pennsylvania - The Wharton School', 'total_student_count': 166}}","{'id': '55057', 'company_display_name': 'Monese', 'total_raised': ['€1.1M', '$1.4M'], 'coinvestor_names': ['Joao Monteiro (Pinto Ventures)'], 'investor_profile_funding_rounds': [{'id': '118984', 'is_lead': None, 'board_role': None, 'funding_round': {'id': '65565', 'stage': 'Venture Round', 'date': '2016-01-05T00:00:00Z', 'amount': '€1.1M'}}, {'id': '59100', 'is_lead': None, 'board_role': None, 'funding_round': {'id': '33144', 'stage': 'Seed', 'date': '2016-01-01T00:00:00Z', 'amount': '$1.4M'}}]}"
5541,Founder at Seven Seven Six,Alexis Ohanian,Series B,"Fort Lauderdale, Florida","Fort Lauderdale, Florida",general_partner,750000,4000000,2000000,Founder at Seven Seven Six,,,,,25,Seven Seven Six,,"{'id': '50714', 'company_display_name': 'MatSatVoxli', 'total_raised': ['$15K'], 'coinvestor_names': [], 'investor_profile_funding_rounds': [{'id': '35987', 'is_lead': False, 'board_role': None, 'funding_round': {'id': '21159', 'stage': 'Seed Round', 'date': '2009-01-01T00:00:00Z', 'amount': '$15K'}}]}"
17109,"General Partner, USVP",Matt Garratt,Series B,"Palo Alto, California","Menlo Park, California",general_partner,500000,40000000,13000000,"General Partner, USVP",,,,,1,U.S. Venture Partners (USVP),,"{'id': '18293', 'company_display_name': 'Gainsight', 'total_raised': ['$110M'], 'coinvestor_names': ['Ajay Agarwal (Bain Capital Ventures)', 'Byron Deeter (Bessemer Venture Partners)', 'Mike Jung (Founders Circle Capital)', 'Nakul Mandan (Audacious Ventures)'], 'investor_profile_funding_rounds': [{'id': '85320', 'is_lead': None, 'board_role': None, 'funding_round': {'id': '13395', 'stage': 'Series B', 'date': '2013-11-06T00:00:00Z', 'amount': '$20M'}}]}"
5919,General Partner @ Andreessen Horowitz,Alex Rampell,Series A,"Palo Alto, California","Menlo Park, California",general_partner,50000,50000000,10000000,General Partner @ Andreessen Horowitz,,,,,19,Andreessen Horowitz,,"{'id': '48082', 'company_display_name': 'Rival', 'total_raised': ['$33M'], 'coinvestor_names': ['April Underwood (Adverb Ventures)', 'Dick Costolo (01 Advisors)', 'Greg Bettinelli (TCG (The Chernin Group))'], 'investor_profile_funding_rounds': [{'id': '34520', 'is_lead': False, 'board_role': None, 'funding_round': {'id': '20261', 'stage': 'Series B', 'date': '2018-05-31T00:00:00Z', 'amount': '$25M'}}, {'id': '34517', 'is_lead': True, 'board_role': None, 'funding_round': {'id': '18434', 'stage': 'Series A', 'date': '2017-07-31T00:00:00Z', 'amount': '$8M'}}]}"
16544,General Partner at Orange Fund,Don Ho,Series A,"San Francisco, California","San Francisco, California",general_partner,100000,5000000,1500000,General Partner at Orange Fund,,,,,1,Pioneer Fund,,"{'id': '53526', 'company_display_name': 'Commonwealth Labs', 'total_raised': ['$5.2M'], 'coinvestor_names': ['Santiago Roel Santos (ParaFi Capital)', 'Ryan Zurrer (Vine Ventures (vine.vc))'], 'investor_profile_funding_rounds': [{'id': '61994', 'is_lead': None, 'board_role': None, 'funding_round': {'id': '30049', 'stage': 'Seed Round', 'date': '2019-03-20T00:00:00Z', 'amount': '$2M'}}]}"
8382,General Partner at Cervin Ventures,Shirish Sathaye,Series A,"San Francisco, California","Palo Alto, California",general_partner,200000,2000000,700000,General Partner at Cervin Ventures,,,,,1,Cervin Ventures,,"{'id': '44548', 'company_display_name': 'OneID', 'total_raised': ['$7M'], 'coinvestor_names': ['Jonathan Heiliger (Vertex Ventures)'], 'investor_profile_funding_rounds': [{'id': '26108', 'is_lead': True, 'board_role': None, 'funding_round': {'id': '10964', 'stage': 'Series A', 'date': '2012-04-11T00:00:00Z', 'amount': '$7M'}}]}"
6207,General Partner at Felicis Ventures,Sundeep Peechu,Seed,"San Francisco, California",San Francisco Bay Area,general_partner,500000,15000000,7750000,General Partner at Felicis Ventures,,,,,15,Felicis Ventures,,"{'id': '11004', 'company_display_name': 'Gobble', 'total_raised': ['$32M'], 'coinvestor_names': ['Lorenzo Thione (Gaingels)', 'Ajay Chopra (Trinity Ventures)', 'Reid Hoffman (Greylock)', 'Craig Shapiro (Collaborative Fund)', 'Eric Paley (Founder Collective)', 'Keith Rabois (Founders Fund)', 'Alexis Ohanian (Seven Seven Six)', 'Garry Tan (Y Combinator)', 'Serena Williams (Serena Ventures)', 'Dirk Van Quaquebeke (BEENEXT)', 'Doug Chertok (Vast Ventures)', 'Jack Abraham (Atomic)', 'Noah Goodhart'], 'investor_profile_funding_rounds': [{'id': '119475', 'is_lead': None, 'board_role': None, 'funding_round': {'id': '40510', 'stage': 'Seed Round', 'date': '2011-05-11T00:00:00Z', 'amount': '$1.2M'}}, {'id': '27231', 'is_lead': False, 'board_role': None, 'funding_round': {'id': '2961', 'stage': 'Venture Round', 'date': '2011-05-11T00:00:00Z', 'amount': '$1.2M'}}]}"
5926,General Partner at Andreessen Horowitz,Connie Chan,Series A,"Menlo Park, California","Saratoga, California",general_partner,500000,40000000,20000000,General Partner at Andreessen Horowitz,,,,,14,Andreessen Horowitz,"{'id': '5464', 'name': 'B.A.', 'field_of_study': 'Economics', 'school': {'id': '25223', 'name': 'Stanford University', 'display_name': 'Stanford University', 'total_student_count': 428}}","{'id': '57929', 'company_display_name': 'Queenly', 'total_raised': ['$9.4M'], 'coinvestor_names': ['Shayna Modarresi (Runway Growth Capital)', 'Corey Goodman (venBio)', 'David Beisel (NextView Ventures)', 'Eric Kwan (Locus Ventures)', 'Gustaf Alströmer (Y Combinator)', 'Michael Seibel (Y Combinator)', 'Jason Wang', 'Jon Brelig', 'Chung-Man Tam', 'Ralph Gootee'], 'investor_profile_funding_rounds': [{'id': '73508', 'is_lead': True, 'board_role': None, 'funding_round': {'id': '40585', 'stage': 'Seed Round', 'date': '2021-07-23T00:00:00Z', 'amount': '$6.3M'}}]}"
11609,Founder and General Partner at K2 Global,Minal Hasan,Post-seed,San Francisco Bay Area,San Francisco Bay Area,general_partner,250000,10000000,1000000,Founder and General Partner at K2 Global,,,,,1,K2 Global,,"{'id': '73980', 'company_display_name': 'RemoteTeam.com', 'total_raised': [], 'coinvestor_names': ['Cindy Bi (CapitalX)', 'Adam Nash (Daffy)', 'Lawrence Braitman'], 'investor_profile_funding_rounds': [{'id': '118766', 'is_lead': None, 'board_role': None, 'funding_round': {'id': '65443', 'stage': 'Pre Seed Round', 'date': '2021-06-01T00:00:00Z', 'amount': '0'}}]}"
9109,General Partner at Foundation Capital,Charles Moldow,Seed,"Menlo Park, California","Menlo Park, California",general_partner,1000000,10000000,5500000,General Partner at Foundation Capital,,,,,11,Foundation Capital,"{'id': '1951', 'name': 'MBA', 'field_of_study': 'Business', 'school': {'id': '25192', 'name': 'Harvard Business School', 'display_name': 'Harvard Business School', 'total_student_count': 310}}","{'id': '20737', 'company_display_name': 'National Payment Network', 'total_raised': [], 'coinvestor_names': [], 'investor_profile_funding_rounds': [{'id': '47546', 'is_lead': False, 'board_role': None, 'funding_round': {'id': '27408', 'stage': 'Series B', 'date': '2009-01-01T00:00:00Z', 'amount': '0'}}]}"
5687,,Michael Marquez,Seed,San Francisco Bay Area,,general_partner,100000,2000000,400000,,,,,,11,Morado Venture Partners,"{'id': '4873', 'name': 'MBA', 'field_of_study': None, 'school': {'id': '25271', 'name': 'University of North Carolina at Chapel Hill - Kenan-Flagler Business School', 'display_name': 'University of North Carolina at Chapel Hill - Kenan-Flagler Business School', 'total_student_count': 4}}","{'id': '22426', 'company_display_name': 'August Home', 'total_raised': ['$73M'], 'coinvestor_names': ['Aileen Lee (Cowboy Ventures)', 'Tony Conrad (True Ventures)', 'Jeff Clavier (Uncork Capital)', 'Rob Stavis (Bessemer Venture Partners)', 'Matt Ocko (DCVC (Data Collective))', 'David Wu (Maveron)', 'Sterling Witzke (Winklevoss Capital)', 'Rick Marini (Catapult Capital)', 'William Guttman (Saturn Partners)', 'Matt Mullenweg (Audrey Capital)', 'Rashaun Williams', 'Philip Kaplan', 'Jay Adelson'], 'investor_profile_funding_rounds': [{'id': '38471', 'is_lead': False, 'board_role': None, 'funding_round': {'id': '21513', 'stage': 'Seed Round', 'date': '2013-03-01T00:00:00Z', 'amount': '$2M'}}]}"
14795,General Partner at Baukunst,Tyler Mincey,Seed,San Francisco Bay Area,San Francisco Bay Area,general_partner,100000,5000000,1500000,General Partner at Baukunst,,,,,1,Baukunst,,"{'id': '58318', 'company_display_name': 'Foundation Devices', 'total_raised': ['$3.2M'], 'coinvestor_names': ['Brett Gibson (Initialized Capital)', 'Stephen Cole (Trammell Venture Partners)'], 'investor_profile_funding_rounds': [{'id': '82328', 'is_lead': True, 'board_role': None, 'funding_round': {'id': '45453', 'stage': 'Seed Round', 'date': '2021-06-10T00:00:00Z', 'amount': '$2.5M'}}]}"
8865,General Partner at Canaan,Joydeep Bhattacharyya,Series B,"San Francisco, California","Menlo Park, California",general_partner,250000,20000000,10000000,General Partner at Canaan,,,,,1,Canaan Partners,,"{'id': '44547', 'company_display_name': 'PerimeterX', 'total_raised': ['$150M'], 'coinvestor_names': ['Ariel Tseitlin (Scale Venture Partners)', 'Jonathan Heiliger (Vertex Ventures)'], 'investor_profile_funding_rounds': [{'id': '70084', 'is_lead': None, 'board_role': {'id': '6410', 'title': 'Board member'}, 'funding_round': {'id': '38937', 'stage': 'Series D', 'date': '2021-02-23T00:00:00Z', 'amount': '$57M'}}, {'id': '70091', 'is_lead': None, 'board_role': {'id': '6410', 'title': 'Board member'}, 'funding_round': {'id': '27964', 'stage': 'Series C', 'date': '2019-09-04T00:00:00Z', 'amount': '$14M'}}, {'id': '70093', 'is_lead': None, 'board_role': {'id': '6410', 'title': 'Board member'}, 'funding_round': {'id': '27962', 'stage': 'Series C', 'date': '2019-02-11T00:00:00Z', 'amount': '$43M'}}, {'id': '15453', 'is_lead': True, 'board_role': {'id': '6410', 'title': 'Board member'}, 'funding_round': {'id': '10957', 'stage': 'Series B', 'date': '2017-07-25T00:00:00Z', 'amount': '$23M'}}]}"
6783,Founder and General Partner at Modern Venture Partners,Andre De Baubigny,Seed,"Menlo Park, California","Menlo Park, California",general_partner,100000,10000000,1000000,Founder and General Partner at Modern Venture Partners,,,,,1,Modern Venture Partners,"{'id': '3334', 'name': 'MBA', 'field_of_study': None, 'school': {'id': '25258', 'name': 'Stanford University Graduate School of Business', 'display_name': 'Stanford University Graduate School of Business', 'total_student_count': 249}}","{'id': '40601', 'company_display_name': 'Agile Stacks', 'total_raised': ['$2.4M'], 'coinvestor_names': ['Maha Ibrahim (Canaan Partners)', 'TK Kuegler (Wasabi Ventures)'], 'investor_profile_funding_rounds': [{'id': '43622', 'is_lead': False, 'board_role': None, 'funding_round': {'id': '23456', 'stage': 'Venture Round', 'date': '2017-12-21T00:00:00Z', 'amount': '0'}}]}"
8502,General Partner at CRV,James Green,Series A,"Palo Alto, California","San Francisco, California",general_partner,500000,20000000,13000000,General Partner at CRV,,,,,1,CRV,,"{'id': '80256', 'company_display_name': 'Astrix Security', 'total_raised': ['$25M'], 'coinvestor_names': [], 'investor_profile_funding_rounds': [{'id': '140554', 'is_lead': True, 'board_role': None, 'funding_round': {'id': '76144', 'stage': 'Series A', 'date': '2023-06-28T00:00:00Z', 'amount': '$25M'}}]}"
6057,General Partner at GV,Andrew Wheeler,Seed,San Francisco Bay Area,"San Francisco, California",general_partner,250000,50000000,25000000,General Partner at GV,,,,,8,GV (Google Ventures),,"{'id': '54942', 'company_display_name': 'Benson Hill', 'total_raised': ['$250M'], 'coinvestor_names': ['Mark Cupta (Prelude Ventures)', 'Carter Williams (iSelect Fund)', 'Adrian Fortino (Mercury Fund)', 'Craig Herron (iSelect Fund)'], 'investor_profile_funding_rounds': [{'id': '68931', 'is_lead': True, 'board_role': None, 'funding_round': {'id': '38304', 'stage': 'Series C', 'date': '2018-09-10T00:00:00Z', 'amount': '$65M'}}]}"
9607,"General Partner, Head of Growth Fund at a16z",David George,Series B,"Menlo Park, California","Palo Alto, California",general_partner,500000,40000000,20000000,"General Partner, Head of Growth Fund at a16z",,,,,1,Andreessen Horowitz,,"{'id': '11921', 'company_display_name': 'Slack', 'total_raised': ['$1.7B'], 'coinvestor_names': ['Andrew Braccia (Accel)', 'Jules Maltz (IVP)', 'Deep Nishar (General Catalyst)', 'Dave Munichiello (GV (Google Ventures))', 'John O’Farrell (Andreessen Horowitz)', 'Marc Andreessen (Andreessen Horowitz)', 'Jeremy Philips (Spark Capital)', 'M.G. Siegler (GV (Google Ventures))', 'Ted Maidenberg (Tribe Capital)', 'Kevin Colleran (Slow Ventures)', 'Mary Meeker (Bond)', 'Mamoon Hamid (Kleiner Perkins)', 'Mood Rowghani (Bond)', 'Ilya Fushman (Kleiner Perkins)', 'Kelly Perdew (Moonshots Capital)', 'Craig Cummings (Moonshots Capital)', 'Sam Huleatt (IntangibleVC)', 'Bryan Rosenblatt (Craft Ventures)', 'Alfred Chuang (Race Capital)', 'Dave Morin (Offline Ventures)', 'Marc Stad (Dragoneer Investment Group)', 'Christian Jensen (Dragoneer Investment Group)', 'Anton Levy (General Atlantic)', 'Daniel Burka', 'MG Siegler', 'Rob Solomon', 'Bradley Horowitz', 'Matt Mazzeo', 'Jeremy Stoppelman', 'Megan Quinn'], 'investor_profile_funding_rounds': [{'id': '73412', 'is_lead': True, 'board_role': None, 'funding_round': {'id': '27998', 'stage': 'Series H', 'date': '2018-08-21T00:00:00Z', 'amount': '$430M'}}]}"
5369,Co-founder and General Partner at Susa Ventures,Chad Byers,Seed,"San Francisco, California",San Francisco Bay Area,general_partner,1000000,1500000,1250000,Co-founder and General Partner at Susa Ventures,,,,,7,Susa Ventures,,"{'id': '16154', 'company_display_name': 'Zephyr Health', 'total_raised': ['$33M'], 'coinvestor_names': ['Brook Byers (Kleiner Perkins)', 'Blake Byers (Byers Capital)'], 'investor_profile_funding_rounds': [{'id': '5518', 'is_lead': False, 'board_role': None, 'funding_round': {'id': '4189', 'stage': 'Series B', 'date': '2014-01-08T00:00:00Z', 'amount': '$15M'}}]}"
8851,General Partner at CRV,Max Gazor,Series A,San Francisco Bay Area,San Francisco Bay Area,general_partner,500000,20000000,13000000,General Partner at CRV,,,,,7,CRV,"{'id': '4209', 'name': 'MBA', 'field_of_study': None, 'school': {'id': '25192', 'name': 'Harvard Business School', 'display_name': 'Harvard Business School', 'total_student_count': 310}}","{'id': '57597', 'company_display_name': 'Prisma SD-WAN', 'total_raised': ['$99M'], 'coinvestor_names': ['Navin Chaddha (Mayfield)', 'Enrique Salem (Bain Capital Ventures)', 'Alexandre Villela (Mindset Ventures)'], 'investor_profile_funding_rounds': [{'id': '119356', 'is_lead': None, 'board_role': None, 'funding_round': {'id': '65726', 'stage': 'Series C', 'date': '2019-04-17T00:00:00Z', 'amount': '$65M'}}, {'id': '70718', 'is_lead': None, 'board_role': None, 'funding_round': {'id': '37122', 'stage': 'Series B', 'date': '2015-05-05T00:00:00Z', 'amount': '$25M'}}, {'id': '119327', 'is_lead': True, 'board_role': None, 'funding_round': {'id': '57704', 'stage': 'Series A', 'date': '2014-04-30T00:00:00Z', 'amount': '$9M'}}]}"
8148,General Partner at Foundation Capital,Steve Vassallo,Seed,San Francisco Bay Area,"San Francisco, California",general_partner,1000000,10000000,5500000,General Partner at Foundation Capital,,,,,7,Foundation Capital,,"{'id': '52370', 'company_display_name': 'Sentient Energy', 'total_raised': ['$23M'], 'coinvestor_names': ['Adam Grosser (UP.Partners)'], 'investor_profile_funding_rounds': [{'id': '45561', 'is_lead': False, 'board_role': None, 'funding_round': {'id': '26357', 'stage': 'Venture Round', 'date': '2015-04-15T00:00:00Z', 'amount': '$7.5M'}}]}"
10563,,Anik Bose,Seed,San Francisco Bay Area,San Francisco Bay Area,general_partner,500000,3000000,2000000,,,,"Startups solving compelling pain points in Industrial IOT, Cybersecurity and Cloud Infrastructure","No consumer internet, fintech, ag or med tech
",2,Benhamou Global Ventures,,"{'id': '40846', 'company_display_name': 'Drishti', 'total_raised': ['$37M'], 'coinvestor_names': ['Martin Casado (Andreessen Horowitz)', 'Jason Green (Emergence Capital)', 'Frank Chen (Andreessen Horowitz)', 'Jim Adler (Toyota Ventures)', 'Yash Hemaraj (Benhamou Global Ventures)'], 'investor_profile_funding_rounds': [{'id': '1993', 'is_lead': True, 'board_role': {'id': '885', 'title': 'Board Member'}, 'funding_round': {'id': '1909', 'stage': 'Seed Round', 'date': '2017-06-05T00:00:00Z', 'amount': '$2M'}}]}"
8354,General Partner at Amplify Partners,Lenny Pruss,Seed,San Francisco Bay Area,San Francisco Bay Area,general_partner,500000,10000000,5000000,General Partner at Amplify Partners,,,,,1,Amplify Partners,"{'id': '641', 'name': 'B.S.', 'field_of_study': None, 'school': {'id': '25231', 'name': 'University of California, Berkeley', 'display_name': 'University of California, Berkeley', 'total_student_count': 197}}","{'id': '74563', 'company_display_name': 'Diagrid', 'total_raised': ['$20M'], 'coinvestor_names': ['David Zilberman (Norwest Venture Partners)', 'Astasia Myers (Quiet Capital)'], 'investor_profile_funding_rounds': [{'id': '121036', 'is_lead': None, 'board_role': None, 'funding_round': {'id': '66708', 'stage': 'Series A', 'date': '2022-10-12T00:00:00Z', 'amount': '$20M'}}]}"
10387,,Mark Menell,Seed,San Francisco Bay Area,,general_partner,200000,50000000,200000,,,,,,1,Partech Ventures,,"{'id': '45197', 'company_display_name': 'FreedomPop', 'total_raised': ['$57M'], 'coinvestor_names': ['Mark Tluszcz (Mangrove Capital Partners)', 'Omri Benayoun (Partech Ventures)', 'Peter Moran'], 'investor_profile_funding_rounds': [{'id': '17553', 'is_lead': False, 'board_role': {'id': '7373', 'title': 'Board Member'}, 'funding_round': {'id': '12388', 'stage': 'Series B', 'date': '2015-07-30T00:00:00Z', 'amount': '$10M'}}, {'id': '17555', 'is_lead': True, 'board_role': {'id': '7373', 'title': 'Board Member'}, 'funding_round': {'id': '12390', 'stage': 'Series B', 'date': '2015-06-17T00:00:00Z', 'amount': '$30M'}}]}"
10709,,Ryan Wang,Seed,San Francisco Bay Area,"San Francisco, California",general_partner,100000,1500000,500000,,,,"- VR/AR
 - Blockchain
 - Artificial Intelligence
 - Particularly interested in companies that's able to drive the adoption.","- Too early, idea level without demo
- Too similar, 10+ other companies doing the same thing
- Founders who haven't done in-depth market research",43,Outpost Capital,"{'id': '4388', 'name': 'Master of Science (M.S.)', 'field_of_study': None, 'school': {'id': '25859', 'name': 'New York University', 'display_name': 'New York University', 'total_student_count': 48}}",
8993,Co-founder and GP at Coalition Operators,Ashley Mayer,Seed,"Brooklyn, New York","Brooklyn, New York",general_partner,100000,5000000,1500000,Co-founder and GP at Coalition Operators,,,,,6,Coalition Operators,"{'id': '8557', 'name': '', 'field_of_study': '', 'school': {'id': '29878', 'name': 'Mercer Island High School', 'display_name': 'Mercer Island High School', 'total_student_count': 2}}","{'id': '76518', 'company_display_name': 'Cellular Longevity, Inc., dba Loyal', 'total_raised': ['$38M'], 'coinvestor_names': ['Claire Hughes Johnson'], 'investor_profile_funding_rounds': [{'id': '128880', 'is_lead': None, 'board_role': None, 'funding_round': {'id': '70905', 'stage': 'Series A', 'date': '2021-09-23T00:00:00Z', 'amount': '$27M'}}, {'id': '128875', 'is_lead': None, 'board_role': None, 'funding_round': {'id': '70902', 'stage': 'Seed Round', 'date': '2020-01-01T00:00:00Z', 'amount': '$11M'}}]}"
5547,Founding General Partner at Bling Capital,Benjamin Ling,Seed,"San Francisco, California","Miami Beach, Florida",general_partner,400000,3000000,1000000,Founding General Partner at Bling Capital,,,,,6,Bling Capital,,"{'id': '10840', 'company_display_name': 'Airtable', 'total_raised': ['$1.5B'], 'coinvestor_names': ['Dan Rose (Coatue)', 'Joshua Kushner (Thrive Capital)', 'Max Gazor (CRV)', 'Peter Fenton (Benchmark)', 'David Samuel (Freestyle Capital)', 'David Tisch (BoxGroup)', 'Adam Rothenberg (BoxGroup)', 'Eric Paley (Founder Collective)', 'Sam Lessin (Slow Ventures)', 'Alexa von Tobel (Inspired Capital)', 'Ashton Kutcher (Sound Ventures)', 'Ilya Sukhar (Matrix)', 'Kevin Mahaffey (SNR)', 'David Beyer (Amplify Partners)', 'Sarah Smith (Sarah Smith Fund)', 'Shan Mehta (CITG Capital)', 'Villi Iltchev (Two Sigma Ventures)', 'Faris Lodin (Sterling Equity)', 'Anthony Simola (Shpira Capital Advisors)', 'Neil Mehta (Greenoaks Capital)', 'Raymond Tonsing (Caffeinated Capital)', 'Daniel Segundo (Off the Chain Capital)', 'Jude Gomila (Jude Gomila Rolling Fund)', 'Katie Stanton (Moxxie Ventures)', 'Amitt Mahajan (Presence Capital)', 'Joshua Reeves', 'Aaron Harris', 'Othman Laraki', 'Michael Birch'], 'investor_profile_funding_rounds': [{'id': '32594', 'is_lead': None, 'board_role': None, 'funding_round': {'id': '1154', 'stage': 'Seed Round', 'date': '2015-02-25T00:00:00Z', 'amount': '$3M'}}]}"
